{"job_id":"probe","raw_path":"raw/metronome/probe.md","canonical_url":"https://docs.metronome.com/probe","title":"Probe","grounding_quotes":[{"id":"q1","line_start":1,"line_end":1,"text":"Quote 1","supports":"Fact"},{"id":"q2","line_start":2,"line_end":2,"text":"Quote 2","supports":"Fact"},{"id":"q3","line_start":3,"line_end":3,"text":"Quote 3","supports":"Fact"}],"overview":"Overview","overview_evidence_quote_ids":["q1"],"key_takeaways":[{"text":"Fact","evidence_quote_ids":["q1"]}],"details":[{"heading":"Details","facts":[{"text":"Fact","evidence_quote_ids":["q1"]}]}],"sections_covered":["Probe"],"scope_boundaries":[],"conditional_requirements":[],"feature_gates":[],"internal_inconsistencies":[],"material_omissions":[],"suggested_tags":["metronome"],"suggested_metronome_concepts":[],"proposed_raw_link":"[[raw/metronome/probe|Probe]]","unsupported_claim_self_check":[]}